clip_idx,tier,gt,target_dominant_type,target_dominant_score,target_second_type,target_second_score,text_dominant_type,text_dominant_score,profile_alignment,weighted_keyword_coverage,unique_keywords,word_count,specificity_score,target_motion_action,target_scene_spatial,target_face_character,target_object_body,target_visual_form,target_language_auditory,text_motion_action,text_scene_spatial,text_face_character,text_object_body,text_visual_form,text_language_auditory,text_motion_action_count,text_scene_spatial_count,text_face_character_count,text_object_body_count,text_visual_form_count,text_language_auditory_count,description
0,tier3_va11y,3,motion_action,0.27586003224206973,face_character,0.2578555218207648,object_body,0.24242424242424243,0.9562811786631117,6.776824553031174,17.0,40.0,0.425,0.27586003224206973,0.13061542270382176,0.2578555218207648,0.18443851761747182,0.15123050561587192,0.1909536294850016,0.18181818181818182,0.13636363636363635,0.21212121212121213,0.24242424242424243,0.13636363636363635,0.09090909090909091,6.0,4.5,7.0,8.0,4.5,3.0,"In a bustling kitchen, a chef holds a cherry tomato and counts down in Spanish. With precision, he throws the tomato at a wall, followed by a knife, which pins the tomato in place. The chef smiles, showcasing his skill."
0,tier2_vatex_long,2,motion_action,0.27586003224206973,face_character,0.2578555218207648,object_body,0.36585365853658536,0.8448507939950888,4.451871902646107,11.0,25.0,0.44,0.27586003224206973,0.13061542270382176,0.2578555218207648,0.18443851761747182,0.15123050561587192,0.1909536294850016,0.2926829268292683,0.07317073170731707,0.12195121951219512,0.36585365853658536,0.0,0.14634146341463414,6.0,1.5,2.5,7.5,0.0,3.0,The man holding the camera is counting backward in spanish as the other man pins a cherry tomato to the wall by throwing a knife.
0,tier1_vatex_short,1,motion_action,0.27586003224206973,face_character,0.2578555218207648,motion_action,0.3333333333333333,0.8691606671484201,2.0737275726704443,6.0,11.0,0.5454545454545454,0.27586003224206973,0.13061542270382176,0.2578555218207648,0.18443851761747182,0.15123050561587192,0.1909536294850016,0.3333333333333333,0.16666666666666666,0.3333333333333333,0.16666666666666666,0.0,0.0,3.0,1.5,3.0,1.5,0.0,0.0,A chef in a kitchen demonstrates his skill throwing a knife
0,tier0_cross,0,motion_action,0.27586003224206973,face_character,0.2578555218207648,motion_action,0.4146341463414634,0.710370667051134,4.085697861978155,11.0,35.0,0.3142857142857143,0.27586003224206973,0.13061542270382176,0.2578555218207648,0.18443851761747182,0.15123050561587192,0.1909536294850016,0.4146341463414634,0.2926829268292683,0.0,0.07317073170731707,0.21951219512195122,0.0,8.5,6.0,0.0,1.5,4.5,0.0,"At night, a skier navigates a snowy hill, weaving between flexible poles in a slalom course. The skier moves swiftly, alternating left and right, purposefully making contact with each pole as they descend the slope."
1,tier3_va11y,3,language_auditory,0.24110124372336494,scene_spatial,0.2150786383677464,face_character,0.25,0.8422471679331653,9.014446837736653,28.0,62.0,0.45161290322580644,0.05761105679200308,0.2150786383677464,0.14000359951309804,0.20849634431950584,0.16502879798638595,0.24110124372336494,0.21428571428571427,0.16071428571428573,0.25,0.16071428571428573,0.08035714285714286,0.13392857142857142,12.0,9.0,14.0,9.0,4.5,7.5,"In a Burger King restaurant, a bald man in a gray hoodie is rapidly eating a hamburger. He takes quick bites and washes them down with a drink. As he continues, he appears to struggle slightly, coughing at times. Around him, people are laughing and clapping, encouraging him to finish. Afterward, someone uses ketchup to write 'BURGER EATING' on a tray liner."
1,tier2_vatex_long,2,language_auditory,0.24110124372336494,scene_spatial,0.2150786383677464,object_body,0.3333333333333333,0.7936105182561078,3.08877286702403,8.0,19.0,0.42105263157894735,0.05761105679200308,0.2150786383677464,0.14000359951309804,0.20849634431950584,0.16502879798638595,0.24110124372336494,0.25,0.16666666666666666,0.08333333333333333,0.3333333333333333,0.0,0.16666666666666666,4.5,3.0,1.5,6.0,0.0,3.0,"A man is at Burger King, eating a hamburger very fast, and going to take a drink of soda."
1,tier1_vatex_short,1,language_auditory,0.24110124372336494,scene_spatial,0.2150786383677464,motion_action,0.5,0.31401927940930147,0.29642198445765167,2.0,13.0,0.15384615384615385,0.05761105679200308,0.2150786383677464,0.14000359951309804,0.20849634431950584,0.16502879798638595,0.24110124372336494,0.5,0.0,0.5,0.0,0.0,0.0,1.5,0.0,1.5,0.0,0.0,0.0,A  man eats a lot of burgers and than starts to get sick.
1,tier0_cross,0,language_auditory,0.24110124372336494,scene_spatial,0.2150786383677464,motion_action,0.4146341463414634,0.5572718122708773,2.8355399203565,11.0,35.0,0.3142857142857143,0.05761105679200308,0.2150786383677464,0.14000359951309804,0.20849634431950584,0.16502879798638595,0.24110124372336494,0.4146341463414634,0.2926829268292683,0.0,0.07317073170731707,0.21951219512195122,0.0,8.5,6.0,0.0,1.5,4.5,0.0,"At night, a skier navigates a snowy hill, weaving between flexible poles in a slalom course. The skier moves swiftly, alternating left and right, purposefully making contact with each pole as they descend the slope."
